{
  "$schema": "https://json-schema.org/draft/2020-12/schema",
  "type": "object",
  "additionalProperties": false,
  "required": ["generated_at", "schema_version", "attribution", "count", "indicators"],
  "properties": {
    "generated_at": {"type": "string"},
    "schema_version": {"type": "integer"},
    "attribution": {"type": "string", "maxLength": 1000},
    "count": {"type": "integer", "minimum": 0},
    "report_count": {"type": "integer", "minimum": 0},
    "indicators": {
      "type": "object",
      "maxProperties": 5000,
      "additionalProperties": {
        "type": "object",
        "additionalProperties": false,
        "required": ["type", "value", "reporters", "categories", "first_reported", "latest_reported"],
        "properties": {
          "type": {"enum": ["ipv4", "ipv6", "domain", "url", "md5", "sha1", "sha256"]},
          "value": {"type": "string", "minLength": 1, "maxLength": 2048},
          "reporters": {"type": "integer", "minimum": 1},
          "categories": {
            "type": "array", "minItems": 1, "maxItems": 10,
            "items": {"enum": ["brute-force","ssh","port-scan","web-app-attack","phishing","malware-c2","scanner","spam","exploited-host","other"]}
          },
          "first_reported": {"type": "string", "pattern": "^\\d{4}-\\d{2}-\\d{2}$"},
          "latest_reported": {"type": "string", "pattern": "^\\d{4}-\\d{2}-\\d{2}$"}
        }
      }
    }
  }
}
