{"generated_at":"2026-10-19T11:13:52Z","schema_version":1,"attribution":"Community-submitted abuse reports from SOCDesk contributors, owner-moderated. Counts of reports, not independent confirmations; a report is an allegation reviewed before publication, not a verdict.","count":3,"report_count":3,"indicators":{"ipv4|185.220.101.34":{"type":"ipv4","value":"185.220.101.34","reporters":1,"categories":["phishing"],"first_reported":"2026-08-24","latest_reported":"2026-08-24"},"ipv4|185.220.101.42":{"type":"ipv4","value":"185.220.101.42","reporters":1,"categories":["phishing"],"first_reported":"2026-08-23","latest_reported":"2026-08-23"},"ipv4|86.127.230.16":{"type":"ipv4","value":"86.127.230.16","reporters":1,"categories":["phishing"],"first_reported":"2026-08-24","latest_reported":"2026-08-24"}}}